,post
0,150+ hosting companies accepting BTC as a payment
1,Old electrum coins
2,Latin American Crypto Exchange Bitso Clears Regulatory Hurdle - US i getting further behind.
3,Want to buy BTC
4,What is the impact of goldcoin mining?
5,Where can I leverage trade Bitcoin without trusting the platform?
6,Bitcoin Price at a Major Decision Point - CryptoFish
7,"""The Currency That's Up 200,000 Percent"" (#1) Bitcoin Archives"
8,Is Hal Finney Satoshi? Mayb
9,Buying Bitcoin with prepaid Visa gift card?
10,Fiat Money Outpaces Bitcoin 800:1 for Money Laundering: Report - CCN
11,IEA Report: Bitcoin Causes 0.03%-0.06% of Global CO2 Emissions
12,"Arthur Hayes Shrugs off CFTC Regulators, “Bunch of Haters”"
13,Quest For The Perfect Bitcoin Wallet
14,Bitcoin for Congress! Let's get some Bitcoin knowledge to the people in Washington!
15,Bitcoin song
16,C# library to help make applications that use Trezor/Ledger/KeepKey
17,Average time of proof of work as a function of the value of transcactions
18,"""TheStoreOfValue"" [art]"
19,Buying bitcoin with minimal fees
20,Inhaling hopium rn. Bitcoin ATM at Aria in Vegas.
21,Hyperbitcoinization and career transitions
22,Cheap bitcoin/crypto clothing?
23,Total ban of cryptocureency in India. Can they prevent it's people for trading Bitcoin?
24,Encodya for GPU mining [Funny]
25,Finding golden nonce .
26,They said it could never be done!
27,"BitMEX, Libra, Warren Buffet - Biggest news in Crypto from last week!"
28,Bitcoin Declared Legal Commodity in Chinese Court
29,Seigniorage belongs to the people - Buy Bitcoin
30,bitcoin-core-review-club
31,I wish Bitcoin's price action was this simple... 80k EOY?
32,"Hostile Websites. Fake Electrum &amp; BIP39 tools. Phishing Scams targeting Electrum, Ledger &amp; Trezor"
33,Indian panel officially submits report and draft bill to government recommending complete cryptocurrency ban - TokenPost
34,"Bitcoin Reclaims $10,000 - Here's What Analysts Expect Next"
35,Coinbase vs Coinbase Pro
36,Bitcoin Economist Saifedean Ammous about Economic Calculation - Trace Mayer - The Bitcoin Knowledge Podcast
37,The bitcoin hodler
38,Need a faster way to buy btc!
39,BAKKT Bitcoin?
40,Your experience with buying bitcoin using Shapeshift.io?
41,Happy Birthday BAKKT 🍰
42,Y guys heard of Mayer multiple? What do you think?
43,Just woke up and..
44,Resource with theories about price drops &amp; rises
45,Best Privacy Android Wallet
46,"Jerry Brito, Executive Director at Coin Center: The Case for Electronic Cash and high level thoughts on Libra"
47,"If Bitcoin Adoption happens, how do you imagine an experience of making​ payment in the future?"
48,Current Problems that have not been solved in the Crypto/Blockchain World
49,So let's talk about IRS letter 6174-A..
50,Bitcoin Economist Saifedean Ammous: Cryptocurrencies Are a Zero Sum Game
51,"Vote for your Bitcoin hero! ""Make Shitcoiners Cry Again"" : Most Hardcore Bitcoin Maximalist award nomination here."
52,In which year do you think Satoshi Nakamoto will be awarded the Nobel Price for Economic Studies?
53,"Picking a Secure 25th Word (BIP39 Passphrase) or avoiding a bad one. For Trezor, Ledger, &amp; Keepkey"
54,Hash-Rate (compute power dedicated to securing Bitcoin) since the all-time-high price
55,I have a Bitcoin Core Wallet from 2013.
56,Bitcoin: Beyond The Bubble (2018)
57,Blockchain mistakes or Bitcoin Theft?
58,Where will BAKKT get their bitcoin?
59,India Bitcoin Ban Recommendation Based on Flawed Arguments
60,An overwhelming urge to follow the moon
61,"Has anyone bought from this site, is it legit? I want to buy this lamp."
62,"General question: At what point does comparing Bitcoin price to fiat (USD) value become meaningless? If Bitcoin reaches 1 million, or more, doesn’t that means the trust in fiat has fallen considerably?"
63,For dollar cost averaging: is it best to SELL in fixed amounts of USD or fixed amounts of BTC?
64,User Acceptance Testing for Bakkt Is Now Live
65,I’ll back to Zimbabwe :)
66,Bitcoin HODLers vs Governments &amp; Traditional Markets
67,Technical Question: Why can't bitcoin miners just give themselves a larger reward?
68,How much is halving gonna effect the btc price?
69,Buying bitcoin through Coinbase help
70,People in US Trust Bitcoin More Than Facebook's Libra: Report - CoinDesk
71,To what extent public-key cryptography secures bitcoin transactions?
72,"What’s Going On With Bitcoin Price, Are We In A Bearish Pattern now?"
73,Iran got a mining park with making 200 bitcoin in day.
74,"New to Bitcoin, Looking on advice of where to buy etc."
75,Amazing reply
76,Question about the relationship of btc and bch
77,Hello Ladies and Gents
78,Are there any non-KYC exchanges?
79,"Bitcoin Network Status Update Sunday, July 21, 2019"
80,Why is it so difficult to get bitcoin
81,Hi everyone. I have come across great readings on bitcoin and cryptocurrencies. Most of which were centered around economics and computer science. I was wondering if you have any popular or insightful books by legal academics on this space. Thank you in advance.
82,Blockchain vs Coinbase
83,How to know if I own any Bitcoin?
84,Satoshi is either dead or happy with the state of bitcoin
85,Time to educate
86,"Run on BitMEX! Customers Withdraw $85,000,000 in 24 hours"
87,The Roubini's and Mnuchin's all ignore...
88,I’m so glad I sold bitcoin way back. Said no one. Ever.
89,Bitcoin Technical Analysis 7/21/2019
90,"A beatifull fine art for beatiful tech - ""Absolute Start"" by Nelly Baksht, 30""x24"" , oil on canvas."
91,Could this prediction be true?
92,Bitcoin consuming energy...not as much as banks.
93,"[Explain It Like I'm 5] Bitcoin Transaction, SegWit, CoinJoin, Confidential Transaction, Bulletproofs, Signature Aggregation"
94,[Question] How to own Bitcoin in India?
95,Tipping - THIS IS AMAZING! - Lighting Wallet
96,Highlights From Professional Cypherpunk Jameson Lopp’s ‘Impromptu AMA’
97,"Coinberry ""security"" so high they are holding my funds ""hostage"""
98,"Pantera Capital CEO Believes Bitcoin Could Reach $356,000 in a Couple Years"
99,Vacation - Bitcoin Rap Official Audio (Post Malone Bitcoin Remix)
100,"Low Barr: Don't give me that crap about security, just put the backdoors in the encryption, roars US Attorney General"
101,Bakkt Launches Bitcoin Futures....
102,"Showerthought: Isn't it ironic that the digital world, which knows no scarcity, produced the most scarce good in the universe?"
103,Is it worth mining Crypto in 2019?
104,How to move btc from lightning
105,Bitcoin: Traders to Be Patient to Find a Direction
106,"Bitcoin, Banking &amp; Alternative Finance"
107,weed-seeds.ca One of my favorite online retailers that accepts and gives bonus seeds for using bitcoin
108,No weakness no rest all work
109,New York Times to Use Hyperledger Fabric Platform to Fight Media Misinformation
110,Andrew Yang Super PAC Will Accept Lightning-Powered Bitcoin Donations
111,"TD Ameritrade CEO: We’re Taking ‘Crawl, Walk, Run’ Approach to Crypto"
112,Don't know much about Btc . Would like to know what is a safe way to buy Btc with usd with a credit card. Any other tips?
113,Why the hell are people using random exchanges I’ve never heard of before?
114,Only 300 day's left!
115,When you're Bitcoin / Lightning Node looks this damn good...
116,The Rise of Corporate Nations
117,I see a new MAJOR THREAT for Bitcoin and Blockchain technology !!!
118,Snowden on Privacy and Bitcoin
119,Robinhood and the halving bext year
120,Norway’s Largest Airline Reveals Bitcoin (BTC) Plans As Crypto Takes Flight
121,Is hodling a good trade plan?
122,"Financial Services Hearing - Rep. Patrick McHenry's opening remarks: ""The world that Satoshi Nakamoto..envisioned, and others are building, is an unstoppable force. We should not attempt to deter this innovation, and governments cannot stop this innovation, and those that have tried already failed."""
123,craigslist post bitcoin accepted and preferred
124,Chamath Palihapitiya: Buffett is WRONG about Bitcoin
125,Bulgaria's Bitcoin Holdings Surpass Their Gold Reserves
126,The Killer App: Bananas on the Blockchain? - Andreas Antonopoulos
127,Transfer from Coinbase to local storage or wallet?
128,Some Bitcoin market research I did. Here are some signals and strategy! Hope you all like it!
129,I sold and price went up. You're welcome everybody
130,Turning Red
131,99 Problems
132,BTC Linux USB Mining
133,PSA: The mempool is very low. 1 sat/byte transactions are clearing in the next block!
134,"Hi guys, check out my interview with David Pope from the Wyoming Blockchain Coalition. He shared great insight on how he and his teammate Caitlin Long passed 5 bills their first year starting the coalition."
135,"The official who framed and submitted the ""banning of crypto currency bill"" in India has been transferred abruptly to another department. Is this a coincidence? Or just a routine transfer????"
136,Naomi Brockwell translates what US Treasury Secretary Mnuchin says about Bitcoin.
137,Bitcoin Big Bang - The Unbelievable Story Of Mark Karpeles (2018)
138,"I know nothing about Bitcoin, but I might have accidentally stumbled onto someone's Bitcoin wallet.."
139,'Hodler of Last Resort' - Bitcoin Board Game Launching
140,"So, looks like the corrupt indian govt is banning crypto and issuing its own shit coin..."
141,Bitcoin is a 'Demographic Mega-Trend' Survey Concludes - Bitcoinist.com
142,Did anyone become more financially aware because of bitcoin?
143,"Lightning Network, Private Keys and Bitcoin Nodes with Jameson Lopp!"
144,Saurel Offers Convincing Reasons Why Bitcoin is Better than Cash
145,$19 Million in Bitcoin Seized from Silk Road Drug Trafficker After Foiled Money Laundering Attempt
146,Monday Art - Hermes Auslander
147,How do I confirm my balance?
148,India’s No to Crypto!
149,"For a lot of people in China, bitcoin is more than just a trading or investment vehicle. With the oppressive Beijing regime constantly clamping down on the lives of its people, many are turning to BTC to subvert the system."
150,Oopsy Poopsy! Miner issued themselves 0BTC
151,"Starting this fall, the biggest airline in Scandinavia, ""Norwegian"" is accepting cryptocurrencies like bitcoin for ticket payments. (Norwegian article)"
152,"Indian gov't panel seeks total ban on private cryptocurrencies, up to 10 years in jail for abusers"
153,More Bitcoin Trend Analysis For You All . Check It Out Guys!
154,It appears some congressmen has just started stocking bitcoins...
155,Looking to recover old btc-e account
156,"Daily Discussion, July 20, 2019"
157,Don't feed the Wales!
158,What are the advantages of running a node on your PC?
159,3D prints for crypto.
160,Can Coinbase know how many Bitcoins I hold in my wallet and is there any limitation on transactions from - to my hosted wallet on Coinbase?
161,Let's Talk Bitcoin! #404 Crypto Plastic; Bitcoin's 90/10 in India
162,Pros and Cons: My Experience Earning Interest with BlockFi
163,"""Institutional demand, I would like to introduce you to our friend, the scarcest asset in the known universe."""
164,Do you agree with this ?
165,Open Source Developers Should Not Doxx Themselves
166,McAfee arrested in Dominican Republic
167,The Free Cryptocurrency Exchange Market Data API
168,‘Bitcoin Billionaires’ Author Puts Crypto Center Stage at Showtime
169,Trillions of Dollars Could Flow into Bitcoin Over Next 25 Years: Grayscale
170,"Lambo is so 2017, what car will this bullrun aim for?"
171,"Looking to buy a laptop to learn blockchain development, what would you reccomend ?"
172,Interview with BitBay Pay CEO — Patryk Kadlec
173,Research Team Finds Bitcoin’s Most Volatile Hour to Be 12 AM to 1 AM (UTC)
174,How Japan is positioning itself to be the next super power economy by do...
175,"New York financial regulators launch new innovation division to regulate, license cryptocurrency businesses - TokenPost"
176,Fidelity’s crypto arm has officially applied to operate in New York as a trust
177,Where do I buy $10 worth of bitcoin?
178,Federal Reserve president says cryptocurrencies tackle
179,Do crypto trading bots really crawl the web for market sentiment?
180,Lightning network test
181,"Venezuela: Maduro collects airport taxes in Bitcoin, instead of Petro, to circumvent United States' sanctions, according to ABC (Spain)"
182,The History and Future of Bitcoin Privacy ~ Tobias Hoffmann ~ Breaking Bitcoin
183,It is changing.
184,Bitcoin Price Update - Bitcoin Price Analysis (BTC) - 07/21/2019
185,"How do you develop technology that is scalable, decentralized and secure?"
186,What we learned from the IRS Cyber Crimes leaked training document | IRS is ready to Subpoena Apples and Googles of the world!
187,Bakkt Launch Until September 30
188,Is a bitcoin wallet possible on this type of device ?
189,Bitcoin one giant leap for mankind. My gf got me this poster
190,When Bitcoin makes you financially aware
191,We should want BAN of bitcoin and demand it on the streets!
192,Themcx.co - broken donation button compromises account credentials
193,Say Hello To My Little Friend
194,OKEx’s Risk Management System Offers Perfect Balance in Risk and Reward for Investors
195,Stolen BTC sent to bitfinex. Trying to find the criminal
196,Bitcoin and Gold market cycles are essentially identical.
197,"Bitcoin is an ""Unstoppable Force"" - Cryptocratist"
198,You heard the lady. GET OUT NOW!
199,Hodl Hodl started first Lightning trading week
200,What is Bitcoin For Beginners
201,"Sos, lost wallet while traveling, can I use my btc?"
202,India panel recommends ban on cryptocurrency
203,6 confirmations in 15 minutes is that possible?
204,[Discussion] What's the biggest problem facing crypto?
205,Update to a couple of Bitcoin's Golden Rules
206,"I am have been using Binance for a long time as my day trade account bring it has so many coins to choose from, I am in the U.S. and wondering what exchange I should switch to that is considered on the up and up and has good security with a large amount of coins to trade. Ty"
207,Are there any ways to safely and legitimately earn interest on my crypto as it sits? I use coinbase but it's kinda boring and I don't like the big fees are there any alternatives?
208,A pizza company in San Diego let’s customers draw on plates and they will hang them up in the store for everybody to see. This was my art.
209,Discussion on Saifedeans BitTorrent comparrison
210,Hooking up Bitcoin Lightning payments in Turbo ‘84 for in app purchases
211,Is BRD a reliable wallet?
212,A Limitation in the Central Bank Language Game - Jon Gulson - Medium
213,$30 Million Shorts Liquidated on BitMEX
214,Saurel Offers Convincing Reasons Why Bitcoin is Better than Cash -
215,"Bitcoin Is a Property, Chinese Court Rules — No Crypto Ban Contradiction"
216,Matrix (1999)
217,Is Bitcoin a Good Investment? Bitcoin Mobile Payments
218,Privacy thought experiment - guess how many bitcoins I own
219,I'd rather pay a small transaction fee with Bitcoin than letting central bankers fuck around with printing their fake money.
220,What is Bitcoin futures trading?
221,Bitcoin Approaches Second Inning as Bakkt Exchange Launch Nears
222,"Bank let me down, Bitcoin did not."
223,Great procession of bitcoin privacy discussion recently and very timely (helps defeat eventually the model of PPAL3.0//Lbraa//FAILB)
224,can i buy bitcoin with a pre paid debit/credit card
225,Solving for Future Hash Question
226,Time to cash in the chips??
227,"1988 Economist Magazine Cover, how much will a Satoshi ultimately be?"
228,Can I mine an empty block ahead of time?
229,Ethereum Is Down 85% Against Bitcoin Since The Peak Of The 'Flippening' Hype
230,VPN with a burner account
231,Thank Gold for crypto.
232,"Bitcoin will remain legal in India while the government works on regulations, a minister has said in new positive comments on the fate of the industry."
233,BitPay wallets not working?
234,Ross’s clemency petition turns 1 year
235,Bitcointalk forum proxy ban
236,"Norwegian Air to accept bitcoin, opening crypto exchange"
237,"I just realized that Earth's perihelion occur on average on january 03, the same date Bitcoin started."
238,"Daily Discussion, July 22, 2019"
239,Steven Mnuchin Hints at New US Crypto Asset Regulations
240,International Energy Agency's report on Bitcoin power consumption
241,"Which are you, a 🐌 or a 🐳?"
242,"Libra Has More Brand Recognition than Ethereum and Ripple, but Not Bitcoin"
243,Bitcoin 2019: Assessing Bitcoin's Strengths and Weaknesses as a Payment Rail
244,BTC is Real Estate
245,Newegg.com Expands Bitcoin Payments to Another 73 Nations
246,How payment for services through cryptocurrency can eradicate poverty
247,When I'm seeing Bitcoin passing 11k again
248,Ex-Microsoft Engineer Charged with Mail Fraud After Stealing Millions in Digital Currency with Bitcoin Mixer
249,Should I hide my bitcoin from the government at the price of convenience?
250,PSA: Learn the tools to safely work with your private keys... TAILS Linux. How to create a secure Air-Gapped environment for Cryptocurrency
251,Time to buy bit cones
252,Website for supported bitcoin stores
253,Deal 'em
254,Armed Robbers Attempt to steal from Bitcoin ATM in England Failed
255,Just bumped on this masterpiece from 2011. I don’t know where the author is right now but if you are seeing this. Sorry mate but you don’t deserve to be a journalist.
256,Bitcoin: Boom Or Bust (2018)
257,Official post to have everyone on r/bitcoin stop calling bitcoin bitcoin and switch to bit cones
258,Letting a Million Channels Bloom
259,The cost of POW
260,"'As to paper money, in any light it can be viewed, it is at best a bubble, the illegitimate offspring of assemblies. Tender laws are tyrannical, to support fraud and oppression.' - T Paine 1786 (Patriot)"
261,"If a business starts accepting bitcoin, what’s the best way to let the world know about it? Is there good directory to be listed on?"
262,Bitcoin price prediction. Full of $hit?!?
263,Bitcoin Optech Newsletter #56
264,"Mentor Monday, July 22, 2019: Ask all your bitcoin questions!"
265,Inside Coinbase's Executive Turmoil
266,Silk Road drug dealer caught allegedly trying to wash $19 million bitcoin
267,"How to get Bitwala addresses and keys from BIP39 mnemonic, BIP49 in particular?"
268,Tipping
269,"Next week, ""media"" will try to explain that bitcoin was a fluke, that we should cave to FB and give millions to Libra. PayPal failed, so it's rebranding as Libra. Libra/FB (PayPal 2.0/3.0) needs to be coming to the crypto industry on bended knee, to prove itself. But it will never beat bitcoin."
270,I need alerts for bitcoin dominance. Suggestions?
271,Tom Lee Scared That Trump May BAN Bitcoin
272,Find and Seek
273,Does LN go a long way to solving bitcoin fungibility?
274,The US GOV and bitcoin?
275,Do you guys know how someone could possibly evade taxes using Bitcoin?
276,Buying BTC with a Chinese UnionPay debit card
277,Highest BTC trade ever publicly recorded - 4164m Breithorn
278,Invoice test for lightning wallet
279,"Poker site earns Guinness World Record for the largest cryptocurrency payment in online poker tournament with $1,050,560 Bitcoin payout"
280,Ok so THAT was finally the LAST time you could buy Bitcoin under 10k
281,"Glad to see the place in Boston, where I work at got the atm machine that can be use to buy Bitcoin."
282,What do y’all think of this bitcoin flyer? Good or bad?
283,Changing hard drives
284,"Trying to spread the word, Let me know what you think!"
285,What Is Genesis Block?🤔Genesis Block Explained! #officialhacker
286,"Daily Discussion, July 21, 2019"
287,Latest Grayscale Report Shows Institutional Bitcoin Investment On The Rise - 17 July 2019
288,SamouraiLeaks Part 3: Is Random.org random enough?
289,Best btc ticker android widget
290,What Is Cryptocurrency Mining?🤔 #officialhacker
291,"Mnuchin: ""I Won't be Loaded up on Bitcoin in 10 Years From Now"""
292,Source to show the growth of BTC wallets since the inception of BTC?
293,"Keiser Report: Orange Coin Good, Orange Man Bad (E1412)"
294,"Bitcoin Weekly Analysis: BTC an ""Unstoppable Force"" Now Recognized as a ""Virtual Property"" in China"
295,Deflation and technological progress
296,This is Elitist
297,Would it be possible to have a non-custodial way of leaving Bitcoin as inheritance?
298,Nice.
299,Can governments kill bitcoin? - CryptoMood - Medium
300,I feel like nipopws are underrated or overlooked. Possibly great solution for fast Light-Clients and Sidechains !
301,Greed
302,I can think of one network more reliable than my bank...
303,Bt-miners.com: scam or legit
304,Is it wrong....
305,Question for a noob about investing
306,Bitcoin bike in front of the bank building
307,Top 5 Cryptocurrency Exchanges with Maximum Multipliers
308,PoW vs PoS - Environment and Security
309,Lightning Network Shower Thought
310,New crypto correlation data reinforce Bitcoin's dominance amidst scrutiny over Libra
311,"Chinese court upholds the legality of Bitcoin ownership, BTC protected by China's property laws"
312,"""We cannot accept private companies issuing their own currencies without democratic control,” Mr Le Maire said"
313,Bitcoiners on the moon
314,Crypt (Scam) Paid Group Leader taken to cleaner by a random dude
315,Bitcoin Playboy Sentenced for Making Money Rain over Hong Kong Neighborhood
316,BCNex as the ultimate blockchain trading platform!
317,Highest Bitcoin trade ever publicly recorded at 4164 meters
318,U.S Treasury Secretary Steve Mnuchin tells it like it is....
319,What happens when a country bans bitcoin?
320,Best Bitcoin wallet for android
321,Introduction to Nakamoto Terminal - A Data Aggregation/Analytics System for Bitcoin and Cryptofinance
322,Will Jeff Bezos And Elon Musk's Satellites Spark Massive Bitcoin Adoption
323,Tokyo Cab Driver Accepts Bitcoin
324,I'm new here. What happened to Bitcoin's dominance in June and July 2017?
325,"Almost $38 billion worth of Bitcoins (4,000,000 BTCs) found untouched (probably lost) for over 5 years now"
326,Hodl Hodl to launch Lightning trading weeks
327,How Bitcoin in China Is Subverting the System
328,"Officials seize $5 million in gold bars at Heathrow Airport, reportedly from drug cartel"
329,Bitcoin Volatility Vs. Gold and USD
330,Can anyone vouch for bread wallet?
331,"Gold Production is Increasing, Bitcoin's Declining; Who Wins the Market?"
332,Is 21 Million Bitcoins Enough? Why this Isn’t a Big Deal
333,What is the destiny of L2 scalability solution named eltoo?
334,What's wrong with my bitcoin tx? it has 29.071 sat/B as a fee and it's almost 7h now.
335,Is it just me or is there a distinct lack of satirical content in crypto? So many taking themselves so seriously. Have you seen some good crypto satire lately? Asking for a friend : )
336,Opinions on Block 528249?
337,Started to average in and just bought my first lot since 3600 today. This is how my ATM looked at these prices.
338,The Libra's cold reception from Congress shows why we need Bitcoin
339,Why can't other people see the inevitability of bitcoin?
340,What is the best free option for storing/sending bitcoin?
341,RPI Lightning node performance
342,Question about Coinmama
343,Money (definition) trees by IMF
344,Question About Bitcoin
345,Two Trillion a Year
346,Trust but Verified
347,8 common mistakes crypto beginners make
348,Bitcoin From Zero to a Million | Experts Opinions
349,Exactly!!
350,Tried Lighting with Blue Wallet and it's very fast.
351,"Can you channel, capture, and reuse the thermal energy released from bitcoin miners?"
352,Idea for a fork: Internet DNS Services
353,Satoshi knew it all
354,US Treasury Secretary Mnuchin Thinks Outlook for Bitcoin Is Bleak - CoinDesk
355,Jesus loves bitcoin and Bitnearby.com
356,"""The software distributed in the recent security updates pushed to your device was developed by the NSA,"""
357,Video: Lightning Implementers Panel
358,Bitcoin's Catch-22 Will Keep It From Spurring a Monetary Revolution
359,This Ohmm mining center can reduce carbon emissions by 7400 metric tonnes p/year if operating fully loaded and utilizing natural gas that would otherwise be vented
360,Bitcoin price shuns volatility as analysts warn of potential drop to $7000
361,Bakkt Is Scheduled to Start Testing Its Bitcoin Futures Contracts Today
362,10'000 is back you say?
363,"Bitcoin Network Status Update Friday, July 19, 2019"
364,Please ELI5 i don't understand anything from this
365,"In one week, the President of the United States, the Treasury Secretary, the Fed Chairman, and members of Congress have all directly mentioned and addressed bitcoin. As a 2012 hodler, My mind is blown."
366,Israeli citizen Eliyahu Gigi arrested over suspects of having stolen $1.7 million worth crypto - BlockInspect
367,What I like most about bitcoin is that it trades 24/7
368,I'm now Dollar Cost Averaging BTC. Any better strategy?
369,Connecting your samori wallet to your full node
370,Billionaire financier weighs in on the future of Bitcoin
371,Bitcoin Transaction Tracker in Augmented Reality
372,Iran Legalizes Crypto Mining
373,So yeah this happened when i was mining for 6 weeks... i think i should get a filter for it...
374,The New York Post dipping pretty low
375,"July 24, 2019"
376,FORTRESS carelessly revealed that I'm a MtGox creditor and where I live to anyone who held this envelope. This is what happens when scumbags get ahold of your confidential data.
377,4% of Americans Chose Bitcoin as Long Term Investment. Not That Significant But We're Getting Close
378,Bitcoin peer-to-peer trading is on the rise says new report
379,"Do I understand this correctly? If you have $100 in BTC and the price goes from $10k to $20k, you now have $200. Correct?"
380,"In the long list of crypto FUDs in India, the most recent one about a 10 year jail sentence was perhaps what caused the most unrest. Well, crypto isn't banned in India and nor is it going to be banned, here are 3 facts to show you why -"
381,Bitcoin Perpetual Watch
382,ist Is worldtrader.org legit ????????
383,Whats next?
