,post
775,"tether whitepaper clearly states on page 4 that is it backed 1:1 by fiat currency (government backed) in hong kong, I may delete this since it's obviously controversial but i've also posted a thread on bitcointalk.org in case anyone would like to followup on this discussion."
776,Normal for funds to be on hold for an extended period of time?
777,Cashapp
778,Lost blockchain wallet. Woe is me
779,2% of Americans Trust Facebook’s Libra More than Bitcoin: Research
780,Amount Of Bitcoin Untouched For At Least 5 Years Reaches An All-Time High
781,Bitcoin likely wasn't supposed to come out until sometime in the 2030's to 2040's...
782,Bakkt Bitcoin Futures @ Critical Mass - Launching in Q3
783,Speed of transmissions
784,The Only Way Is Down for Central Bankers Already at Peak Rates
785,Interview with Juthica Chou on The First Physically Settled Bitcoin Futures
786,PROMO: Buy or Sell Bitcoin P2P on LocalCoinSwap and WIN up to $850 USD in BTC. Giveaway ends Aug 31.
787,We Will Always Expect Crypto Exchanges to Act Like Our Banks
788,Can the poor American get rich with investing in bitcoin?
789,"When does bitcoin hit $25,000?"
790,"In honor of the 50th Anniversary of the moon landing: ""Bitcoin to the Moon!"""
791,"Norwegian Air to Accept Bitcoin, Open Exchange"
792,The Satoshi Nakamoto Bitcoin Blocksize Mystery
793,What do you want to buy with your bitcoin?
794,Bitcoin-Gotta Cash 'em All (Pokemon Parody) By Jason Paige-The Original Theme Singer
795,TX not being broadcast
796,Cryptoart: Bitcoin Obituaries
797,Questions about a Bitcoin Standard...
798,Bought in the dip instead of selling in the dip and it feels good. Might keep doing that.
799,"I want to start buying, but I'm still learning and I do not know which wallet to choose."
800,"Patrick McHenry ""I think there's no capacity to kill bitcoin"""
801,Mind blowing...
802,"Bitcoin Network Status Update Saturday, July 20, 2019"
803,Water Shortages in Venezuela – You Can Help With Bitcoin
804,BTC with VPN
805,Bitcoin Economist Saifedean Ammous on MONETARY HISTORY - Trace Mayer - The Bitcoin Knowledge Podcast
806,"First Purchase with Crypto Gains #meteorite, black diamond, 2 green diamonds, 24k gold"
807,The Three Best Ways to Trade Bitcoin
808,It's has been more difficult to buy bitcoin for me lately.
809,Here we go again
810,Would it be safe for me to only use a mobile wallet?
811,"Between Libra and Bitcoin, I Want Bitcoin Interview with Tim Draper"
812,Bitpay
813,This is the shirt of crypto enthusiast
814,Just to let any new people to the game know. Stay away from blockchain wallet.
815,Brute forcing bitcoin addresses - stumbled upon this puzzle that people are still struggling to solve. Can anyone ELI5?
816,Do you have to pay taxes everytime you sell and buy in the U.S?
817,What is the cryptocurrencies wallet comparison?
818,Anyone proposing a course of action in case CSW is Satoshi?
819,Gold for criminals.
820,BitCoin startups in Europe
821,"'Bitcoin, not Blockchain' as Crypto VC Plunges 60%"
822,recommend me a site please?
823,2140 after all bitcoin are mined
824,Does anyone know where to buy a bitcoin ticker?
825,Coinbase - How To Get Bitcoins in 2019
826,Andreas Antonopoulos Talks About People Who Say Crypto Isn't Useful
827,So.. Who in the World hasn't heard of Bitcoin yet?
828,Philippine Bank Successfully Finishes Blockchain-Powered Remittances Pilot Project
829,Hal Finney is the Ultimate Hodler
830,Faketoshi
831,Where do you store your hardware wallet and 24 word security code?
832,"Coinscrum_markets:: Charles McGarraugh's Market Overview :: Crypto Markets - Past, Present &amp; Future tldr; Bullish for Bitcoin"
833,Not all TA is equal
834,Which bitcoin wallet for ios is the most trustworthy and why?
835,777 mbtc Bitcoin Puzzle
836,"We don't need new currency, there are already plenty, we just need the technology. We can integrate current financial system to blockchain and make it free from fractional reserve which is the real problem.."
837,Coinbase passes 30million users
838,What's hitting the HDD?
839,"Daily Discussion, July 25, 2019"
840,Stop being a slave
841,You can now buy Bitcoin with Gold and Silver via Bitpanda
842,Using BTC in an establishment
843,"It’s the settlement assurances, stupid - Nic Carter"
844,Survey: Only 4% of Americans Say Bitcoin/Cryptocurrencies Is Their Favorite Long-Term Investment
845,What if...
846,Regarding electrum wallet Recovery:
847,Not Fake News: TD Ameritrade CEO Confirms REAL Demand for Bitcoin
848,Has anyone used Ledn to earn interest on Bitcoin holdings?
849,Ep 18 - No Capacity to Kill Bitcoin! (says US Congressman!)
850,"Bitcoin is a rare example of collective action succeeding in practice. When you exit fiat you take a leap of faith that others will too and you won’t be alone. When a decentralized movement gets to a critical mass it becomes very hard to oppose. Buy BTC, they can’t stop all of us"
851,SamouraiLeaks Part 2— Harassment of Bitcoin Developers
852,The Canadian dollar doesn't inflate the USD dollar supply just like BitcoinCash or the other Bitcoin forks doesn't inflate the Bitcoin (BTC) supply.
853,Downloading blockchain to external hard drive
854,Could this be the best asic miner seller worldwide?
855,Unconfirmed: Crypto Evangelist John McAfee has been Detained
856,How Bitcoin in China Is Subverting the System - China Uncensored producer Matt Gnaizda sat down with Bitcoin expert Leo Wheese. He’s the President of the Bitcoin Association of Hong Kong.
857,How has blockchain tech fared against other mainstream technologies since the genesis of its first cryptocurrency? This article has a very interesting take.
858,What do you think?
859,Bulgaria has more Bitcoin than gold
860,Bitcoin stock to flow ratio
861,Does anyone else feel this way?
862,"Sanctions-hit Iran becoming ‘heaven’ for bitcoin mining, says govt official"
863,The Epic of Bitcoin: How Narrative and Ideology Drives Value in Crypto | Ben Hunt
