,post
384,"Top 7 Best Anonymous Bitcoin Wallets, Reviewed for 2019"
385,Mark Cuban is Becoming a Leader for Cryptocurrency in Professional Sports
386,Mining
387,Crypto Energy Drink from Poland. HODL
388,"The next Antonopoulos (without the salty, crass character)."
389,extra charge appears on Blockchain.com
390,5 Professions that didnât Exist before the Blockchain
391,Quick question...say I buy 1 Bitcoin at 10k. At 15k btc value I buy a 15k item directly with the same Bitcoin....do I owe any capitol gain tax
392,The lambo meme is a distraction. They want to take your only $BTC for just one car. Don’t fall for it.
393,"Bitcoin News: After Year of Hype, Bakkt Soft Launches With Closed Beta - Bitcoin Magazine"
394,Virgin Bitcoins taint Bitcoins Fungible property
395,Guide to configuring bitcoin-core and c-lightning ports
396,Crypto can prevent money laundering better than traditional finance
397,For the transactions THEY say you CAN'T make. Spotted in Brighton
398,The Unspoken Stable Bargain - Jon Gulson - Medium
399,Iran to create national cryptocurrency backed by gold
400,Coinbase CEO Brian Armstrong on Siraj Raval's podcast
401,"Benjamin Franklin willed the cities of Boston and Philadelphia $4,400 each in 1790, but with the stipulation that the money could not be spent for 200 years. By 1990 Boston’s trust was worth over $5 million. If I create an NTimeLock transaction for 200 years, will it still be spendable then?"
402,Coindesk Contributor Says Trump Unlikely to Attempt a Ban on Bitcoin
403,The Parable of the Talents
404,Are there any transaction that was never confirmed?
405,Thanks to Dave Bitcoin of Wallet Recovery Services I recovered .3 bitcoins along with some Bitcoin Cash that I bought back in 2013. I had forgotten my password for the account of a online wallet and Dave was able to crack it. Just wanted to spread the word and let others know of his services.
406,How would you gift bitcoin?
407,Expert Wall Street Trader Eric Crown Shares His Bitcoin Trading Perspectives
408,Looking for survey feedback regarding blockchain and your financial experiences!
409,"Why nobody ever gets to hear when it's a good time to buy, like 2 days ago when I told everyone this would be the last chance to buy Bitcoin at sub 10k prices"
410,Why do all crypto currencies have the same movement?
411,FYI: Bitstamp is under scheduled maintenance.
412,Show Reddit: Lightning Connect Four
413,"""With Wasabi if you are mixing 10 BTC, I can trivially track that 10 BTC as it is peeled down into smaller utxos. The left over change is part of the mix tx, and thus creates a determinstic link"""
414,Bitcoin Wallet App Development: Understanding Types of Wallets
415,It is impossible for Bitcoin to succeed and have high fees
416,Where do you buy your bitcoin? I bought mine through coinbase. Is there a better site to buy it?
417,Bakkt Futures Platform Finally Starts Testing after Numerous Delays
418,Bitcoin won’t have made it until we stop referring to it in our own currency.
419,Does anyone know how these whales buy and sell bitcoin for a fraction of the costs?
420,"Blocktick SaaS - Document Certification through the Blockchain Technology Using Bitcoin, Ethereum and EOS blockchains for ensuring the existence and integrity of the digital documents."
421,When all fails
422,Spark access key?
423,"Between Libra and Bitcoin, I Want Bitcoin | Interview with Tim Draper - Cointelegraph"
424,"First dental clinic in Budapest to accept Bitcoin. If you heard about dental tourism, then you know why this is a great DEAL."
425,Bitcoin Drop Price For Future Contracts
426,Bitcoin Economist Saifedean Ammous on Time Preference - The Bitcoin Knowledge Podcast - Trace Mayer
427,"Bitcoin vs. Libra, will Libra be a force for good? Will it help the future bitcoin? Video virtual networking+webinar event -July 26- All you need to know after congress hearings"
428,JPMorgan: We Believe The Dollar Could Lose Its Status As World's Reserve Currency
429,How do I access my BTC?
430,Hail Bitcoin!
431,Interview with Saifedean Ammous on Understanding Bitcoin Economics
432,Miami Dolphins to accept Litecoin &amp; Bitcoin for 50/50 raffle
433,Which roundup app/site do yall use?
434,BTC Network Now More Powerful Than Ever Before
435,What do you think - How possibile is it that someday 1 satoshi could be worth 1$?
436,INSTITUTIONS are BUYING Bitcoin behind YOUR back!
437,Buying for Canadians Easy Peasy?
438,Anyone else happy with this sideways movement?
439,How the blockchain is changing money and business | Don Tapscott
440,Daily Crypto Blog: The trend of Bitcoins still shows a slight downward movement.
441,"Coinbase Averages 21,917 New Users Every Day"
442,Anyone lending btc on crypto.com
443,What are people’s thoughts about using https://www.bullionexchanges.com to liquidate bitcoin into gold ounces that get mailed to you?
444,Breaking — $313 Million BTC Moved for $69 in Suspected Dump
445,What to buy online with bitcoins?
446,Bitcoin ownership legal in China: Hangzhou Digital Court Affirms
447,Oh No! Not the Death Cross! FUD
448,Seems like not that bad of a time to buy. Mayer Multiple is at 1.68 while halving is around the corner.
449,Transaction not confirming
450,Hodl Hodl and L2B Global form new OTC desk
451,"Major US banks hostile toward Bitcoin, accounts at risk of closure, cryptocurrency businesses prohibited"
452,"mnuchin says ""treasury will ensure bitcoin doesn't become 'swiss-numbered bank accounts"""
453,The Creation of Nash Equilibria in Bitcoin - Jon Gulson - Medium
454,7 events that could start the next global financial crisis &amp; lead to Bitcoin
455,"""I can assure you I will personally not be loaded up on bitcoin"" in 10 years, says Treasury Secretary Mnuchin #bitcoin"
456,"Cross-chain — new paradigm: Many pundits argue that public blockchains will consolidate to only a handful in the future; however, there are many scenarios in which a new public blockchain is needed"
457,Chart and Candles
458,Steven Mnuchin: I would bet even in 5 to 6 years I won’t even be talking about bitcoin as Treasury Secretary
459,"Bitcoin, Gold, Libra, &amp; Govt: Jeff Berwick, Fmr head of US Mint, + more!"
460,According to media... BTC vs Zuckbucks
461,Sun Yuchen’ s 30 million
462,I’ve made something :) and would love to have some possible beta testers for my new app CoinControl!
463,Court Declares Bitcoin Legal in China as a 'Virtual Property’
464,Lil Bubble - When Moon? (Parody)
465,Uhhh? Taken 7/20/19 lol. I wish!!!!
466,Met Tom Lee yesterday! Fumbled my words but he was super nice.
467,Am I getting screwed by Wirex or is this normal ?
468,$28 million Liquidated on BitMEX as Bitcoin falls 2.5%
469,Hallmark Moment
470,Happy anniversary!
471,Which U.S. Libertarian Party candidate do you think would be the best option to debate Donald Trump on stage about crypto-currencies and other technologies?
472,BTC Being Held in a Value Channel?
473,How to remove Trezord bridge witch always calling from my mac ??????
474,"Monday Art - Dean ""Zeus"" Colman"
475,tattoo seed
476,"As Global Recession Risk Grows, Bitcoin “Gold 2.0” Narrative Strengthens"
477,Anonymously buying bitcoin?
478,A Pull Request in Bitcoin Core which will simplify fee negotiation for the Lightning Network was merged!
479,The Foundations of Wealth Part 7of 10 - Money
480,"Daily Discussion, July 24, 2019"
481,Why would governments around the world buy cryptocurrencies when they can just take yours?
482,Monarch wallet
483,"The Bitcoin News Show #111 - Libra hearings, Bitcoin thwarting sanctions, Bitstamp lightning node"
484,The Fall of the US Dollar and Which Currency Could Become the Next Super Power Currency? - Simon Dixon
485,"If you're certain BTC will reach new heights, but you're looking for the right place to top up / accumulate, FYI:"
486,NY State Plans to Rewrite Laws to Allow It to Seize 'Abandoned' Bitcoin
487,It's nice to be able to use my favorite mug at work again without being criticized.
488,"Bitcoin Hashrate, Difficulty and Tx Output Values Reach All Time Highs"
489,"Craig Wright's misinformed attempt at scaling Bitcoin, BSV frivolously increasing block size to 2GB"
490,Is it true that agencies are tracking bitcoin?
491,The Best Automated Trading Tools for Bitcoin
492,What It’s Like to Review Bitcoin's Code - CoinDesk
493,Bulgaria Now Holds More Bitcoin Than It Does Gold - Blockspectator
494,Americans Misunderstand the Bitmex CFTC Probe
495,"No official ban on cryptocurrency yet, Indian Minister clarifies - TokenPost"
496,How do we cover our virtual tracks from potential future threats?
497,Video: The Killer App: Bananas on the Blockchain?
498,Satoshi's secret
499,How many of you
500,Bitcoin Heist (2016)
501,Bakkt Testing Finally Launched- Will It Be Boom Or Bust For Bitcoin? - Blockspectator
502,Stack
503,Éclair Wallet question?
504,Revolution market
505,bullish arguments for bitcoin if trump places an all out ban
506,9 Reasons for Using Bitcoin instead of Cash
507,The upcoming halvings...
508,"10,000 seconds = $1"
509,Always on time！
510,Tone Vays INTERVIEW: Bitcoin to $100K after the NEXT halving in 2024! | Chepicap
511,Some rare information found about Bitcoin
512,BTC Hashrate ATH | AT&amp;T $24M Sim Swap Lawsuit
513,Willy Woo Discusses the Greatest Threat to 'Bitcoin's Dream'
514,Security recommandations for stock and spend Bitcoin
515,What does a clownfish have in common with the SEC? Hint: neither one should regulate crypto
516,"Bitcoin Network Status Update Tuesday, July 23, 2019"
517,Escrow
518,Weekend Bitcoin side project - historical DCA calculator interesting to anyone but myself?
519,Chancellor On Brink transitional artwork [GIF]
520,BTC considered an important subject by Handelsblatt
521,"Bitcoin is more than money, its digital fire."
522,Hodl ftw
523,Cold card customization
524,"I don't want to wait until ""Mentor Monday""..."
525,Lil Bubble - When Moon? (Mad World Bitcoin Parody)
526,I think I've lost my BTC (Bitcoin Armory)
527,Any 401k companies have bitcoin accounts?
528,Legit Cloud Sites / Apps
529,A Complete Guide to BITCOIN ETFs: What You Need to Know in 2019
530,Can someone explain what happened to exchanges in the past 1.5 years?
531,Noob question: How safe is it to transfer from an exchange to your wallet?
532,Crypto Banking Company FairX Shuts Down Due to Lack of Financing
533,Official Indian Govt Press Release on Crypto &amp; New Digital Rupee Cryptocurrency
534,Method Of Loci Wallet?
535,Taxes and virtual items
536,Bitcoin: The End Of Money As We Know It (2015)
537,"Want to gift a close friend some bitcoin for his wedding, which wallet should I use?"
538,How would our community respond if Bitcoin is outlawed?
539,"CEO of World’s Largest Asset Manager Makes the Case for Crypto (Blackrock, Larry Fink)"
540,A painting by Danny Stephens
541,A piece by my 10 YO niece. Had to make it BTC themed to subtly introduce the concept 🙂
542,How to start?
543,My favorite Bitcoin hip hop track - ytcracker - Bitcoin Baron (2014)
544,Interview with Kraken's Nicholas Percoco on Defending the Crypto Honeypot
545,"Bitcoin to $42,000 2019 Forbes article"
546,"I told a friend Bitcoin enables financial freedom, he replied you're stupid just use Paypal... please help"
547,Does anyone know how to efficiently cloud mine BTC
548,Saifedean Ammous on Understanding Bitcoin Economics - WhatBitcoinDid
549,Found a Bitcoin sticker outside of a restaurant in Montreal
550,What Do You Guys Do As Jobs?
551,From Blockchain to In Chains - Silk Road Dealer Arrested in US 6 Years After Ulbricht Takedown
552,The reasons behind India’s Ban on Cryptocurrencies
553,Buying off LBC vs. Buying off wallet (like BRD)?
554,ARTICLE: Why are India potentially banning private crypto?
555,How do we know when we've reached the Moon?
556,Pretty much the nay sayers have a script they run from to make themselves feel better.
557,Upvote if you want a discussion between Roy Sebag and Andreas Antonopoulos
558,"Kuva + Symphony Update: 3D Bitcoin Transaction Tracker, ARVR, and More Symphony Events Coming"
559,If I had a nickel every time I heard this I’d have one Bitcoin
560,Libra Hearings Summary - 9 Hours In Under 9 Minutes
561,How does schnorr signature aggregation create an economic incentive to use coinjoin in a private manner?
562,LND node not catching up to mainnet
563,"BitmexRekt bot suspended on Twitter for ""Impersonation"""
564,Bitcoin And Cryptocurrency Market Could Keep Rising
565,Any precautions/how not to get scammed when buying Bitcoin for cash person-to-person?
566,"Bitcoin Network Status Update Monday, July 22, 2019"
567,Oh the irony
568,Buying through cash app
569,Bought my first few satoshis the other day. Any advice for a newbie other than HODL and get a hardware wallet?
570,"Crypto Not Prohibited In India, Confirms Minister Anurag Thakur"
571,"BTCPay Server Directory - Website where you can showcase your BTCPay projects, stores, apps"
572,The Bitcoin Phenomenon (2014)
573,Midnight Conspiracy
574,When did it finally click for you guys?
575,Meanwhile in Brazil
576,Moving from Robinhood to a hard wallet
577,Question on Bitinfocharts
578,Just got my Lightning node up and running! Had a question about LND autopilot maybe you guys could answer.
579,Would I be profitable?
580,Bitcoin was trending in the top 30 ‘Hot’ posts on Reddit today
581,Reminders Fyi for newbs
582,Best Crypto exchange as of July 2019???
583,Bitcoin Perpetual Clock - Looking for some feedback. Would you buy?
584,Make BTC do something already
585,BitMEX Being Investigated by US Regulators Over Trading Practices
586,Predicting the future of bitcoin. What would it takes.
587,NOOB IN THE CASE VOL.1
588,Raiders hold up Bitcoin store in front of dozens of witnesses
589,Having issues verifying my ID with my Coinjar account (using Auspost digital ID).
590,How To Make Own Cryptocurrency Wallet - A Complete Guide for Beginners
591,Bitcoin Is 'Best Long Term Investment' Per 4 Percent Americans: Study
592,Iran officially recognizing cryptocurrency mining as an idustry
593,Best book to give someone who doesn't know too much about cryptocurrency
594,Auto invest spare change roundups into Bitcoin
595,Recommended beginners set up
596,"John McAfee: ""We Need To Give Control Of Currency Back To The People"""
597,Bitcoins war against drugs..
598,"Did you know Cristiano Ronaldo makes 10,480.77 BTC in 2019 at todays current rate?"
599,WTF!!! Indian Panel Proposes Fines and Jail Time for Cryptocurrency Use
600,Bitcoin's Owning Tiananmen Square
601,PSA: Electrum wallet users receiving fake update notifications prompting install of malware versions
602,Crypto Platforms during economic collapse
603,Auto transfer to private wallet
604,"Any online surveys, jobs, or tasks that payout in BTC/crypto?"
605,How To Invest In Bitcoin?
606,Brand new trailer to the first feature length movie about bitcoin: The Last Thieves 聖人大盜 英文版預告
607,Having a business and receiving Bitcoin from illegal activities
608,Bitcoins exchange (Ibiza)
609,What metal to engrave words?
610,Cash App
611,Bitcoin Network Now More Powerful Than Ever Before &amp; More
612,I need help on ways to get bitcoin.
613,Can someone make a post with a list of congress and state officials who support Bitcoin? I don't vote but I will now.
614,HODL Perspective Needed
615,Why Bitcoin is NOT a Pyramid Scheme
616,Buying A Pack of Gum with Bitcoin Because Rep. Sherman Said I Can't
617,Be Careful: Safe Deposit Boxes are NOT safe !!
618,"Joe Kernen, the unsung hero we need but don't deserve. We appreciate you sir! Keep asking the hard questions. 👏"
619,Potential bitcoin exchange scam?
620,Fidelity’s Crypto Branch Files for a New York Trust License
621,U thought bitcoin almost lost control?
622,Woke up due to some wacky dreams. This made up for it... bitcoin exactly at 10k. We had some dips below 10k. -- me at 350am
623,"There exists an entity operating as a de-anonymizing “hot wallet” present within transactions by Wasabi since June 1, 2019. This entity has been clustered very easily due to flagrant address reuse, and downright bizarre behavior. This impacts ALL users since June."
624,An Honor and a Shame. Turing's Face Slapped on £50 Fiat
625,Interested in getting started on the Lightning Network? Start here!
626,"Bitcoin hater is embarrassing himself on TV - "" cash isn’t used for illicit activities""- @mnuchin"
627,Question about how to use bitcoin securely.
628,Block timestamps
629,A story of regret like so many others
630,WasabiLeaks — Is Wasabi Wallet Deanonymized?
631,Fees and exchanges?
632,"Bitcoin Q&amp;A: Block Height, Syncing, and Validation - Andreas Antonopoulos"
633,Almost fixed
634,I don't know if this has its place here but I thought it was interesting. No more fake news? Is this even possible? But that'd be amazing to such thing appear thanks to blockchain.
635,Rebalance lightning channels in Eclair
636,Reasons NOT to use a paper wallet?
637,is there a way to buy bitcoin at full price with giftcards
638,https://youtu.be/wD3KYlpE2lk
639,bitcoin purchases being denied by my Canadian Bank
640,Almost 80 EH/s – Bitcoin hashrate reached a new record level
641,verifiable delay functions for proof of work
642,"Bitcoin would be a calamity, not an economy"
643,Mass Adoption vs Mass Rejection
644,Safest Exchange?
645,Ladies and gentlemen it's time! Place your bets for the price of bitcoin at the end of 2019!
646,Tim Draper example in interview is me
647,BAKKT opens today!
648,Suggestions ?
649,Coinbase vs cash app
650,Bitcoin Mixing Question.
651,Find traders within your locality with cryptomap.me
652,Questions about “banning bitcoin”
653,What do you think of Samourai Wallet?
654,Is it possible that bitcoin could contribute to a financial crisis and even make it worse?
655,Why is r/Bitcoin censored?
656,Bitcart : Integrate crypto currency payment easily into your store without any 3rd party or limits
657,"It may not be much, but this is my reward for HODLing the 2013 equivalent of $0.18 :)"
658,"Pantera CEO: $42,000 Bitcoin Price By The End Of 2019 'A Good Shot'"
659,Mindfulness cards are now available to buy using bitcoin!
660,Issue with a LN channel
661,Should a company attack a shitcoin publicly or simply ignore them?
662,Financial situation in the 2050s starterpack
663,Not The Future We Wanted
664,Bitcoin is a Demographic Megatrend
665,What's a good context to use the Bitcoin Lightning Network?
666,Bitcoin vs Gold: Pros and Cons
667,Bitcoin does it once more
668,All the worlds bitcoin mining equipment only uses 3.75 kilograms of electrons per hour!
669,Where would my Bitcoins be stored?
670,"Mnuchin (translation): ""I am personally loaded up on bitcoin already"""
671,Where do you keep the card that has your seed?
672,Seen this at museum in Tel-Aviv
673,Apps for my Ledger Nano S?
674,Bitcoin Selling on CashApp vs Coinbase
675,‘Intellectuals yet idiots’: RT’s Keiser Report tests theory about central bankers
676,Apple Co-Founder Helps Establish Blockchain-Powered Energy Efficiency Firm
677,Is there a way to auto-buy BTC each week?
678,This month Bitcoin4Photos launched a new web application allowing content creators to sell their…
679,"Daily Discussion, July 23, 2019"
680,Community thoughts on the OpenDime project.
681,"Future without cash? Giving up Cash, ING questionaire"
682,Bitcoin still on track
683,Should I buy?
684,"No, You Can't Time the Bitcoin Market"
685,You're unknown shitcoin isn't going to be the platform of the future
686,The US dollar when you put it through the age test on FaceApp..
687,What can I do with 11 words?
688,Bitcoin: What an Interesting Battle This Is!
689,Bakkt Futures Testing | Poloniex Goes Offshore | Financial Crisis Triggers
690,Fiat outpaces Bitcoin in money laundering 800 to 1
691,GBTC where to buy?
692,Has bitpay fixed it so that you can withdraw fiat from ATM machines yet?
693,You absolutely cannot trust American institutions as the leaders in the space.
694,$100 Early Bird for March 2020 San Francisco Bitcoin Conference
695,coding
696,Coinbase Stole $50 ACH
697,Inverse Correlation Between Bitcoin and TSLA?
698,Btc vs Crypto...
699,Pantera Capital's Bold Prediction: '$356K Bitcoin Is Only A Few Years Away' - Blockspectator
700,The Stabilising of Nash Equilibria in Bitcoin - Jon Gulson - Medium
701,Thought you guys would appreciate my new personalized patch
702,Got fined 500 euro's for driving 20 km/h too fast. I swear I'll only buy and sell through Bitcoin when I get the chance. Enough taxes.
703,Is Bitcoin GOOD Money? - Simon Dixon
704,What do you guys think is the best way to buy Bitcoin and also what do you think is the best way to store it?
705,At Buycrypto.Today a valid SEPA IBAN is all that is needed to create buy | sell offers for Bitcoin. It's a new P2P crypto to fiat exchange for the European market.
706,What are the most non-hype trustworthy bitcoin news sites?
707,Is Adam Back suggesting what I think he's suggesting in this interview?
708,Does any site keep a list of largest (bytes) blocks.
709,China sights FBI famed Bitcoin-Seeking Ransomware ‘Ryuk’ Virus
710,I hope that Bakkt doesn't launch
711,The level of ignorance towards crypto is laughable
712,Check out new &amp; improved fee estimator. Bookmark and share with others! :)
713,13 Best Bitcoin Documentaries Of All Time (Updated 2019)
714,Bitcoin Hardware Wallet Comparison
715,Any others out there?
716,Live your dreams. And you know you living right #bitcoin
717,Who Owns the Federal Reserve - US dollar is an private oligarch currency.
718,Let's discuss KYC: I believe the current KYC standards put everyone who has submit their identification at significant risk of physical or cyber attacks.
719,Generating encrypted BIP38 paper wallet from existing address / digital wallet
720,What's in development for Bitcoin? Is there a roadmap for future updates?
721,"If reports of Iran's gold-backed crypto are true, then the US might start a war sooner than we think... Iran is foolish to not use Bitcoin"
722,Does anyone feel one day divisions of bitcoins will have friendly names?
723,Buying and keeping crypto/cash at Coinbase
724,Trying to find a picture of bitcoins ATH.
725,"And Oldy, But a Goody. What Does the FED Fear? - ₿itcoin"
726,People are taking the red pill on bitcoin because of libra
727,"FML I'm an actual idiot and hate myself right now... Ok, so we all know how u/IMayMarry was the legend who tipped people an insane amount of BCH to the community as if it's like the commom occurence of a fart coming out my arse each day. Anywayyyy I decided to put my tip onto antminercreditors but.."
728,"Nobody says ""I'm not interested in having US Dollars because they're not tight to gold"""
729,Lost half of my btc over gambling. First post. Help please
730,Was Bitcoin Created by This International Drug Dealer? Maybe!
731,"Audiomusic about wealth building, everything he says makes me think BITCOIN is a huge part of the answer: NAVAL - HOW TO GET RICH | Full Album | Lofi hip-hop | Meaningwave | Akira The Don"
732,Blockchain Technology Use Cases in Real Life🤔 #officialhacker
733,Struggling to transfer downloaded Blockchain to different PC
734,"Quick, upvote this to confuse everyone into thinking the price jumped back up."
735,Meltem Demirors Complete Congressional Testimony on Libra &amp; Bitcoin - 07/17/2019
736,"Bixfinex to NY Attorney General: ""Alleged US Customers are Foreign Entities"""
737,Bitcoin and the Multilateral Evolution - Jon Gulson - Medium
738,"Bitcoin Network Status Update Wednesday, July 24, 2019"
739,"What came first, the value or the usage?"
740,How to accept USD payments on my site that are directly converted to bitcoins
741,Is it safe to keep my private keys on google drive?
742,BIP-23 criticism: Why have we made miners generate new a new merkleroot instead of increase the nonce space to 64bit?
743,Measures of Decentralization - a thought-provoking thread from 2015. Has anyone taken action?
744,"Updates re: Taproot, Schnorr, MAST in layman's English?"
745,Bakkt is coming
746,"Honest, Quality BitCoin market?"
747,What is the dollar point where you will no longer be buying bitcoin?
748,Multichain wallet or Bitcoin only wallet?
749,It’s here
750,"Gold vs Bitcoin YTD Returns on $1,000 Investment, How Do They Compare?"
751,Monday Art - Johnny Dollar
752,What happens when countries start buying Bitcoin?
753,Le Roux Biographer: Cartel Boss Is the Most Credible Satoshi Yet
754,I found an old PC in my attic that a roommate was borrowing when he lived with me ~7 years ago. I think he may have used it for mining BTC. How can I check to see if anything is on the drives?
755,"2032 at the Citadel. Sorry Dad, please process my waste water if you're thirsty."
756,Private key -produces two different addresses
757,Is Nick Satoshi? Does it matter
758,Internet Of Crypto Trading Bot #IOCT
759,What It’s Like to Review Bitcoin’s Code
760,Bitcoin - Don't panic !
761,Bitcoin True Face...
762,"What impact, if any, do you think Bakkt launching their physically backed futures on Monday will have?"
763,Safe Deposit Boxes Not Safe - New York Times
764,How hard will it be to buy BTC in the future?
765,Facebook's Libra Means the Death of Privacy | Hacker Noon
766,"[Question - Serious] Perhaps I am a luddite, or maybe no one has thought of this solution to replacing bitcoin addresses with something easier to handle."
767,Japanese General Trade Company to Finance Blockchain-Based Power Sourcing Platform
768,Bitcoin is to the Blockchain what Land is to the Earth. Bitcoin is digital real estate.
769,Bakkt begins user testing bitcoin futures
770,"Daily Discussion, July 19, 2019"
771,Americans trust Bitcoin over Facebook's Libra by far
772,Active scammer on Instagram
773,Your experience with btc atms? &amp; looking for a recommendation for a btc atm in nyc
774,Bitcoin is anti-corruption by its very nature.
